{
  "$schema": "https://json-schema.org/draft/2020-12/schema",
  "$id": "finops.calculate.request.schema.json",
  "title": "finops.calculate request",
  "type": "object",
  "additionalProperties": false,
  "properties": {
    "inputs": {
      "type": "object",
      "additionalProperties": false,
      "properties": {
        "nRef": { "type": ["number", "null"], "minimum": 1, "maximum": 100000 },
        "currency": { "type": ["string", "null"], "enum": ["EUR", "GBP", "USD", "eur", "gbp", "usd", null] },
        "devPerClient": { "type": ["number", "null"], "minimum": 0 },
        "infraTotal": { "type": ["number", "null"], "minimum": 0 },
        "ARPU": { "type": ["number", "null"], "minimum": 0 },
        "startupTargetPrice": { "type": ["number", "null"], "minimum": 0 },
        "startupTargetClients": { "type": ["number", "null"], "minimum": 1 },
        "cudPct": { "type": ["number", "null"], "minimum": 0, "maximum": 95 },
        "margin": { "type": ["number", "null"], "minimum": 0, "maximum": 200 },
        "nMax": { "type": ["number", "null"], "minimum": 10, "maximum": 100000 },
        "techDomains": {
          "type": "array",
          "items": {
            "type": "string",
            "enum": ["cloud", "saas", "licensing", "private-cloud", "data-center", "labor"]
          },
          "uniqueItems": true
        },
        "costSaaS": { "type": ["number", "null"], "minimum": 0 },
        "costLicensing": { "type": ["number", "null"], "minimum": 0 },
        "costPrivateCloud": { "type": ["number", "null"], "minimum": 0 },
        "costDataCenter": { "type": ["number", "null"], "minimum": 0 },
        "costLabor": { "type": ["number", "null"], "minimum": 0 },
        "reliabilityEnabled": {
          "type": ["boolean", "string"],
          "enum": [true, false, "on", "off"]
        },
        "sloTargetAvailabilityPct": { "type": ["number", "null"], "minimum": 0, "maximum": 100 },
        "sliObservedAvailabilityPct": { "type": ["number", "null"], "minimum": 0, "maximum": 100 },
        "incidentCountMonthly": { "type": ["number", "null"], "minimum": 0 },
        "mttrHours": { "type": ["number", "null"], "minimum": 0 },
        "incidentBlendedHourlyRate": { "type": ["number", "null"], "minimum": 0 },
        "criticalRevenuePerMinute": { "type": ["number", "null"], "minimum": 0 },
        "arrExposedMonthly": { "type": ["number", "null"], "minimum": 0 },
        "slaPenaltyRatePerBreachPointMonthly": { "type": ["number", "null"], "minimum": 0 },
        "reliabilityInvestmentMonthly": { "type": ["number", "null"], "minimum": 0 },
        "minutesInMonth": { "type": ["number", "null"], "minimum": 1 },
        "incidentFteCount": { "type": ["number", "null"], "minimum": 0 },
        "criticalTrafficSharePct": { "type": ["number", "null"], "minimum": 0, "maximum": 100 },
        "churnSensitivityPct": { "type": ["number", "null"], "minimum": 0, "maximum": 100 },
        "breachProbabilityPct": { "type": ["number", "null"], "minimum": 0, "maximum": 100 },
        "slaPenaltyMonthly": { "type": ["number", "null"], "minimum": 0 }
      }
    },
    "providers": {
      "type": "array",
      "items": {
        "type": "string",
        "enum": ["aws", "azure", "gcp", "oci", "ibm", "alibaba", "huawei", "multi"]
      },
      "uniqueItems": true
    },
    "hiddenCurves": {
      "type": "array",
      "items": {
        "type": "string",
        "enum": ["dev", "infra-raw", "infra-cud", "total", "total-rel", "revenue", "profit", "profit-rel", "price-min"]
      },
      "uniqueItems": true
    },
    "options": {
      "type": "object",
      "additionalProperties": false,
      "properties": {
        "includeHealth": { "type": "boolean", "default": true },
        "includeRecommendations": { "type": "boolean", "default": true },
        "includeSeries": { "type": "boolean", "default": false },
        "includeStateToken": { "type": "boolean", "default": true }
      }
    }
  },
  "required": ["inputs"]
}
